{
  "name": "holoscan-deltacast",
  "kind": "module",
  "issues_url": "https://github.com/deltacasttv/holoscan-modules/issues",
  "source": {
    "type": "git",
    "url": "https://github.com/deltacasttv/holoscan-modules.git",
    "ref": "886307f219f69a5ef4c8f05ccc2257afb626d77c",
    "path": "."
  }
}
