{
  "name": "holoscan-applications",
  "kind": "application",
  "issues_url": "https://github.com/nvidia-holoscan/holoscan-applications/issues",
  "source": {
    "type": "git",
    "url": "https://github.com/nvidia-holoscan/holoscan-applications.git",
    "ref": "main",
    "path": "applications"
  }
}
